question,answer,source_file
Mỗi phát biểu sau là Đúng hay Sai ?,"['A. Tỉ lệ A/G của đoạn gene mã hóa S1 là 5/3.', 'B. Đáp án : Đúng', 'C. Đoạn gene mã hoá S1 có thể đã xảy ra đột biến thay thế cặp nucleotide T = A bằng cặp A = T ở hai vị trí để tạo ra S2.', 'D. Đáp án : Đúng', 'E. c.Nếu phân li các đoạn gene mã hoá S1 và S2 thành các mạch đơn, sau đó cho chúng bắt cập thành từng đôi ngẫu nhiên với nhau thì tổ hợp hai mạch bắt cặp chính xác tối đa chiếm tỉ lệ 1/18.', 'F. Đáp án : Đúng', 'G. d. Trong cùng điều kiện phản ứng, người ta nhận thấy hiệu quả xúc tác của biến thể E2 thấp hơn E1, chứng tỏ đột biến này đã làm thay đổi cấu trúc, chức năng của protein nên hiệu quả xúc tác phản ứng của E2 kém hơn.', 'H. Đáp án : Đúng']",1764087247632-Sinh_Dethi_ThptNguyenTatThanh.docx
Câu 2,"['A. 5.12_3+3+3+3-3+2+3+3_4. Ở một loài vẹt, tính trạng màu sắc lông do ba cặp gene Aa, Bb, Dd phân li độc lập cùng quy định theo sơ đồ chuyển hoá sau:']",1764087247632-Sinh_Dethi_ThptNguyenTatThanh.docx
"Cho biết các allele a, b, d không tổng hợp enzyme để chuyển hoá. Theo lí thuyết, mỗi phát biểu sau đây là Đúng hay Sai?","['A. a.Allele D tương tác với allele A hoặc B để tạo ra màu lông tương ứng là màu tím hoặc xanh lá cây.', 'B. Đáp án : Đúng', 'C. b.Trong quần thể, số loại kiểu gene của kiểu hình màu xanh da trời nhiều hơn kiểu hình màu tím là 2.', 'D. Đáp án : Đúng', 'E. c.Số phép lai tối đa xảy ra giữa một con vẹt màu xanh lá cây dị hợp và một con vẹt màu trắng là 24.', 'F. Đáp án : Sai', 'G. d.Phép lai giữa một con vẹt màu tím và một con vẹt màu đỏ tạo ra F1 có thể có tỉ lệ kiểu hình: 3 màu tím : 3 màu đỏ : 2 trắng.', 'H. Đáp án : Đúng']",1764087247632-Sinh_Dethi_ThptNguyenTatThanh.docx
Câu 3 .,"['A. 3.6_2+2+1+1_2+2+1+1_4. Một nhóm học sinh trồng ba cây giống nhau vào ba chậu và đặt chúng trong các điều kiện nhiệt độ khác nhau: Chậu 1: Nhiệt độ 25°C; Chậu 2: Nhiệt độ 10°C; Chậu 3: Nhiệt độ 40°C. Sau 10 ngày, cây ở chậu 1 phát triển bình thường, cây ở chậu 2 sinh trưởng chậm, còn cây ở chậu 3 bị héo và chết. Xác định những mệnh đề sau đúng hay sai.', 'B. a.Cây sinh trưởng tốt nhất ở nhiệt độ 25°C.', 'C. Đáp án : Đúng', 'D. b.Nhiệt độ không ảnh hưởng đến sinh trưởng của cây.', 'E. Đáp án : Sai', 'F. c.Nhiệt độ quá thấp hoặc quá cao đều có thể làm giảm sinh trưởng của cây.', 'G. Đáp án : Đúng', 'H. d.Cây ở chậu 3 chết vì nhiệt độ quá cao làm rối loạn quá trình trao đổi chất.', 'I. Đáp án : Đúng']",1764087247632-Sinh_Dethi_ThptNguyenTatThanh.docx
Câu 4,"['A. 7.19_2+2+3+3_2+2+2+2_4. Hầu hết các vùng đất nông nghiệp trù phú nằm trong vùng trùng và bị đe dọa bởi nước biển dâng. Loài Spartina patens và Typha angustifolia là những thực vật đám lấy ở khu vực nội lục châu Mỹ. Để nghiên cứu ảnh hưởng của nước biển tới hai loài thực vật này, các nhà nghiên cứu đã tiến hành một loạt các thí nghiệm: trồng chung hoặc trồng riêng hai loài thực vật trong các đám lấy nước mặn và đám lấy nước ngọt, hoặc trong nhà kính với các độ mặn khác nhau. Sinh khối trung bình (g/cm²) của hai loài được thể hiện ở Hình a và b.', 'B. a. Tại độ mặn 20% thì sinh khối trung bình của loài S. patens cao gấp khoảng hai lần của loài T. angustifolia.', 'C. Đáp án : Đúng', 'D. b. Khả năng chịu mặn của loài S. patens tốt hơn loài T. angustifolia.', 'E. Đáp án : Đúng', 'F. c. Ở đầm lầy nước ngọt, loài T. angustifolia có ưu thế cạnh tranh tốt hơn.', 'G. Đáp án : Đúng', 'H. d. Ở khu vực do triều cường khiến nước biển dâng lên cao thường xuyên, trống loài S. patens sẽ bảo vệ đất nông nghiệp hiệu quả hơn.', 'I. Đáp án : Đúng', 'J. Phần III. Dạng thức trắc nghiệm dạng trả lời ngắn']",1764087247632-Sinh_Dethi_ThptNguyenTatThanh.docx
Câu 1.,"['A. 7.18_1_1_4. Giả sử lưới thức ăn ở hình 3 gồm các loài sinh vật được kí hiệu; A, B, C, D, E, F, G, H, I. Cho biết loài A là sinh vật sản xuất và loài E là sinh vật tiêu thụ bậc cao nhất. Sự thay đổi số lượng cá thể của loài H liên quan trực tiếp đến sự thay đổi số lượng cá thể của bao nhiêu loài trong lưới thức ăn trên?', 'B. Đáp án : 2']",1764087247632-Sinh_Dethi_ThptNguyenTatThanh.docx
Câu 2.,"['A. 7.18_3_3_4. Lưới thức ăn sau đây có bao nhiêu chuỗi thức ăn?', 'B. Đáp án : 3']",1764087247632-Sinh_Dethi_ThptNguyenTatThanh.docx
Câu 3,"['A. 7.19_1_1_4. Biết năng lượng mặt trời chiếu xuống một hệ\xa0sinh thái là 9.109\xa0kcal. Năng lượng của sinh vật sản xuất là 45 x\xa0108\xa0kcal. Năng lượng sinh vật tiêu thụ bậc 1 là 45.107\xa0kcal, của sinh vật tiêu thụ bậc 2 là 9.107\xa0kcal. Hiệu suất sinh thái của sinh vật tiêu thụ bậc 2 so với sinh vật tiêu thụ bậc 1( tính theo %) là:', 'B. Đáp án: 20%', 'C. HD', 'D. Hiệu suất sinh thái của sinh vật tiêu thụ bậc 2 và sinh vật tiêu thụ bậc 1 là :', 'E. 9.107\xa0 : 45.107\xa0 = 0,2 = 20%']",1764087247632-Sinh_Dethi_ThptNguyenTatThanh.docx
Câu 4,"['A. 5.13_3_2_4. Một cặp vợ chồng đến tư vấn di truyền sau khi người vợ bị sảy thai liên tiếp và chưa sinh được người con nào. Khi phân tích bộ NST của cặp vợ chồng, người chồng bị chuyển đoạn giữa NST số 3 và NST số 21, còn người vợ có bộ NST bình thường. Hình dưới đây minh họa cho 6 khả năng của bộ NST trong tinh trùng người chồng, trong đó, màu đen là NST số 3, màu trắng là NST số 21.']",1764087247632-Sinh_Dethi_ThptNguyenTatThanh.docx
"Trong 6 khả năng nói trên, có bao nhiêu trường hợp con sinh ra không mắc hội chứng Down?","['A. Đáp án : 3', 'B. Giải thích:', 'C. Con sinh ra không mắc bệnh Down nếu giao tử của người bố rơi vào trường hợp 1,3,5 .']",1764087247632-Sinh_Dethi_ThptNguyenTatThanh.docx
"Vì giao tử ở các trường hợp còn lại (2,4,6) có 2 chiếc NST chứa thông tin của NST số 21, kết hợp với giao tử của mẹ có thể sinh ra con có 46 NST nhưng vẫn gây ra các hội chứng của Down. (HC Down do di truyền từ bố hoặc mẹ bị đột biến chuyển đoạn NST số 21 với một NST khác trong cơ thể)","['A. Thành phần năng lực: Tìm hiểu thế giới sống', 'B. Kiến thức: Di truyền quần thể người', 'C. Chỉ báo: TH4', 'D. Cấp độ tư duy: Vận dụng']",1764087247632-Sinh_Dethi_ThptNguyenTatThanh.docx
Câu 5,"['A. 5.14_3_3_4. Ở người, tính trạng hói đầu do một gene có 2 allele quy định, allele B quy định hói đầu, allele b quy định kiểu hình bình thường. Kiểu gene Bb quy định hói đầu ở nam và bình thường ở nữ. Trong một quần thể cân bằng di truyền, trung bình cứ 10.000 người thì có 100 người bị hói. Tỉ lệ người có kiểu gene bb trong quần thể là bao nhiêu? (Viết kết quả dưới dạng số thập phân, làm tròn 2 chữ số sau dấu phẩy)', 'B. Đáp án : 0,98', 'C. HD:', 'D. Nam: bị hói: BB, Bb; bình thường: bb', 'E. Nữ: bị hói BB; bình thường: Bb, bb', 'F. Gọi p là tần số allele B', 'G. q là tần số allele b.', 'H. Tỉ lệ người bị hói:  =', 'I. + pq = 0,01', 'J. Ta có: q = 1 – p', 'K. Cấu trúc di truyền của quần thể: p2 BB + 2 pq Bb + q2 bb = 1', 'L. 0,0001 BB + 0,0198 Bb + 0,9801 bb = 1']",1764087247632-Sinh_Dethi_ThptNguyenTatThanh.docx
Câu 6,"['A. 6.15_2_3_4. DDT là một loại thuốc trừ sâu hữu cơ tổng hợp nhân tạo, được sản xuất quy mô công nghiệp và sử dụng rộng rãi từ năm 1940. DDT rất hiệu quả để phòng trừ sâu bại trong thời gian đầu, tuy nhiên chỉ trong vài năm đã xuất hiện các quần thể sâu kháng thuốc DDT. Quá trình tiến hoá của sâu theo trình tự thời gian có thể gồm các ý như sau:', 'B. (1) Hầu hết quần thể sâu kháng với DDT.', 'C. (2) Xuất hiện đột biến ở một gene mã hóa enzyme làm sâu có khả năng kháng thuốc.', 'D. (3) Cá thể sâu mang gene kháng thuốc sinh sản và truyền allele quy định khả năng kháng thuốc qua các thế hệ.', 'E. (4) Các cá thể sâu nhạy cảm với DDT bị chết khi con người dùng thuốc trừ sâu.', 'F. (5) Tần số của allele kháng thuốc trong quần thể tăng lên.', 'G. (6) Sâu mang gene kháng thuốc có ưu thế chọn lọc và sống sót.']",1764087247632-Sinh_Dethi_ThptNguyenTatThanh.docx
Các bạn học sinh sắp xếp các ý trên theo trật tự quá trình tiến hoá của sâu như sau:,"['A. Học sinh 1: (4)→(6)→(2)→(3)→(5)→(1).', 'B. Học sinh 2: (2)→(6)→(4)→(3)→(5)→(1).', 'C. Học sinh 3: (4)→(6)→(3)→(2)→(5)→(1).', 'D. Học sinh 4: (2)→(4)→(6)→(3)→(5)→(1).']",1764087247632-Sinh_Dethi_ThptNguyenTatThanh.docx
"Trong bốn bạn trên, bạn học sinh nào có quan điểm đúng?",['A. Đáp án : 4'],1764087247632-Sinh_Dethi_ThptNguyenTatThanh.docx
