question,answer,source_file
"Câu 1: Trong các bằng chứng tiến hóa, bằng chứng nào là chính xác nhất?","['A. Hóa thạch.\t\t\t\tB. Bằng chứng giải phẫu so sánh.', 'C. Bằng chứng tế bào học.\t\tD. Bằng chứng sinh học phân tử.']",1764087247632-Sinh_Dethi_ThptNguyenTatThanh.docx
Câu 2: Ví dụ nào sau đây nói lên tính chuyên hoá của enzyme?,"['A. Trong 1 phút, một phân tử amylase thuỷ phân được 1 triệu phân tử amylopectin.', 'B. Amylase chỉ thuỷ phân được tinh bột, không thuỷ phân được cellulose..', 'C. Amylase bị bất hoạt ở nhiệt độ trên 60 0C hoặc dưới 00C.', 'D. Amylase có hoạt tính xúc tác mạnh ở môi trường có pH từ 7 đến 8.']",1764087247632-Sinh_Dethi_ThptNguyenTatThanh.docx
"Câu 3: Cấu trúc nào sau đây tổng hợp protein điều hoà, protein này tham gia điều khiến họat động của operon Lac ở vi khuẩn E. coli?",['A. Vùng điều hoà.\tB. Vùng vận hành.\tC. Gene điều hoà.\tD. Gene cấu trúc Z'],1764087247632-Sinh_Dethi_ThptNguyenTatThanh.docx
Câu 4: Cơ thể có bộ NST nào sau đây thuộc đa bội lẻ?,['A. n.\tB. 3n.\tC. 4n.\tD. 2n + 1.'],1764087247632-Sinh_Dethi_ThptNguyenTatThanh.docx
"Câu 5: Theo lí thuyết, loại giao tử abd có tỉ lệ 12,5% được tạo ra từ cơ thể có kiểu gene",['A. AaBbDd.\tB. aaBbDd.\tC. AaBbDD.\tD. aabbDd.'],1764087247632-Sinh_Dethi_ThptNguyenTatThanh.docx
Câu 6: Thành tựu nào dưới đây được tạo ra từ ứng dụng của phương pháp lai hữu tính?,"['A. Vi khuẩn E. coli sản xuất hormone insulin của người.', 'B. Giống gà đông tảo ở Hưng Yên có kích thước lớn; chân to, thô.', 'C. Dê chuyển gene sản xuất sữa chứa protein CFTR chữa bệnh u xơ nang.', 'D. Cừu chuyển gene tổng hợp protein của người trong sữa.']",1764087247632-Sinh_Dethi_ThptNguyenTatThanh.docx
"Câu 7 : Một quần thể có thành phần kiểu gene là 0,16 AA: 0,48 Aa: 0,36 aa Theo lí thuyết, tần số allele A của quần thể này là","['A. 0,7.\tB. 0,3.\tC. 0,4.\tD. 0,5.']",1764087247632-Sinh_Dethi_ThptNguyenTatThanh.docx
Câu 8: Bằng chứng trực tiếp cho thấy các sinh vật đã tồn tại và tiến hoá trên Trái Đất là,['A. hoá thạch.  B. cơ quan tương tự.  C. cơ quan tương đồng.  D. cơ quan thoái hoá'],1764087247632-Sinh_Dethi_ThptNguyenTatThanh.docx
"Câu 9: Ở thực vật, thông tin kích thích sẽ được truyền qua tế bào chất dưới dạng nào?","['A. Hormone, enzyme.\t\tB. Dòng điện tử hoặc chất hóa học.', 'C. Tín hiệu thần kinh. \t\tD. Dòng mạch gỗ và mạch rây.']",1764087247632-Sinh_Dethi_ThptNguyenTatThanh.docx
"Câu 10: Năm 2020, hiện tượng cháy rừng ở Australia đã làm cho số lượng thủ có túi giảm mạnh. Sự biến động số lượng cá thể của quần thể thú có túi là dạng biến động","['A. theo chu kì nhiều năm.\tC. theo chu kì ngày đêm.', 'B. theo chu kì mùa.\t\tD. không theo chu kì.']",1764087247632-Sinh_Dethi_ThptNguyenTatThanh.docx
Câu 11: Đàn chim hải âu lông mày đen (Thalassarche melanophris) ở quần đảo Falkland làm tổ cách đều nhau trong mùa sinh sản. Hiện tượng này mô tả kiểu phân bố cá thể của quần thể nào sau đây?,['A. Phân bố đồng đều.\t\tB. Phân bố nhóm.\tC. Phân bố ngẫu nhiên.\t\tD. Phân bố rời rạc.'],1764087247632-Sinh_Dethi_ThptNguyenTatThanh.docx
Câu 12: Để xác định tuổi hóa thạch người ta dùng phương pháp:,"['A. quan sát hình thái bên ngoài hóa thạch.\tB. quan sát hình thái bên trong của hóa thạch.', 'C. dựa vào vị trí tìm được hoá thạch.\t\tD. dựa vào lượng đồng vị phóng xạ có trong hóa thạch.']",1764087247632-Sinh_Dethi_ThptNguyenTatThanh.docx
"Câu 13:  Quá trình hình thành các hợp chất hữu cơ từ các chất vô cơ, xảy ra khi Trái Đất mới hình thành. Đây là đặc điểm của giai đoạn:","['A. tiến hoá hoá học.\t\tB. tiến hoá tiền sinh học.', 'C. tiến hoá sinh học.\t\tD. tiến hoá tiền hoá học.']",1764087247632-Sinh_Dethi_ThptNguyenTatThanh.docx
"Câu 14: Trường hợp nào sau đây, huyết áp trong hệ mạch của người sẽ bị giảm?","['A. Tim đập nhanh và mạnh.\tB. Cơ thể bị mất nhiều máu.', 'C. Ăn mặn trong thời gian dài.\tD. Người bị bệnh xơ vữa động mạch.']",1764087247632-Sinh_Dethi_ThptNguyenTatThanh.docx
"Câu 15: Một protease có một trung tâm họat động chứa ba góc glutamic acid (Glu) liên tiếp; vùng này được mã hoá bởi trình tự nucleotide trên mRNA: 5'-GAA-GAA-GAA-3: Nếu bị đột biến gene, trình tự mới nào sau đây có khả năng tạo ra sản phẩm protein có mình tự amino acid giống protein ban đầu nhất? Biết các codon mã hoá amino acid là GAG-3, 5'-GAA-3': Glu; 5'-GGA-3': Gly; 5'-CAA-3': Gin.","[""A. 5'-GAA-GGA-GAA-3’.\tB. 5'-GAG-GAG-GAA-3’."", ""C. 5'-GAA-UAA-AGAA-3’.\tD. 5'-GAA-CAA-AGAA-3’.""]",1764087247632-Sinh_Dethi_ThptNguyenTatThanh.docx
"Câu 16: Hiện tượng con chim công đực có màu sắc sặc sỡ thu hút được nhiều chim cái giao phối làm tăng khả năng sinh sản, tuy nhiên, màu sắc sặc sỡ cũng làm cho nó dễ bị nhiều loài săn mồi phát hiện. Điều này chứng tỏ","['A. đặc điểm thích nghi chỉ mang tính tương đối.', 'B. đặc điểm thích nghi không thay đổi.', 'C. cơ thể cần có nhiều đặc điểm thích nghi bền vững.', 'D. khả năng sinh sản quyết định khả năng thích nghi.']",1764087247632-Sinh_Dethi_ThptNguyenTatThanh.docx
"Câu 17: Hình sau mô tả ba kiểu phân bố cá thể của quần thể trong môi trường thuộc ba loài giả định trong diện tích như nhau. Cho rằng các khu vực còn lại của ba quần thể nghiên cứu là không có sự khác biệt so với mô tả ở hình dưới và mỗi dấu chấm minh họa cho một cá thể. Theo lí thuyết, có phát biểu nào sau đây là sai?","['A. Kiểu phân bố I thể hiện cá thể tận dụng được nguồn sống tiềm tàng trong môi trường.', 'B. Kiểu phân bố II xảy ra khi điều kiện sống phân bố đồng đều trong môi trường.', 'C. Kiều phân bố III thể hiện hiệu quả nhóm.', 'D. Kiểu phân bố 1 là kiểu phân bố phổ biến nhất.']",1764087247632-Sinh_Dethi_ThptNguyenTatThanh.docx
"Câu 18: Một thí nghiệm chuyển gene thông qua plasmid đã được tiến hành trên đối tượng vi khuẩn X. Biết rằng vi khuẩn này vốn không có khả năng kháng chất kháng sinh tetracycline, plasmid dùng làm thể truyền có chứa gene kháng thuốc kháng sinh tetracycline. Sau thí nghiệm, nhà khoa học tiếp tục chuẩn bị hai lô vi khuẩn (A, B), trong đó một lô chứa vi khuẩn × bình thường (chưa được xử lí ), lỗ còn lại là vi khuẩn × có chứa DNA tái tổ hợp trên; hai loại đĩa thạch có môi trường cơ bản (Z, Y ) trong đó một loại có chứa chất kháng sinh tetracycline và một loại đĩa không chứa chất kháng sinh trên. Tiếp tục nuôi cấy hai loài vi khuẩn A, B vào môi trường hai loại đĩa thạch được bố trí như sau:","['A. - Lô I: Đĩa thạch không chứa tetracycline + vi khuẩn bình thường.', 'B. - Lô II: Đĩa thạch không chứa tetracycline + vi khuẩn đã được xử lí.', 'C. - Lô III: Đĩa thạch chứa tetracycline + vi khuẩn bình thường.', 'D. - Lô IV: Đĩa thạch chứa tetracycline + vi khuẩn đã được xử lí.']",1764087247632-Sinh_Dethi_ThptNguyenTatThanh.docx
"Theo lí thuyết, những nhận định nào sau đây đúng?","['A. 1. Chỉ những vi khuẩn × có chứa DNA tái tổ hợp trên có tính kháng tetracycline.', 'B. II. Vi khuẩn A và vi khuẩn B lần lượt là vi khuẩn × bình thường và vi khuẩn × có chứa DNA tái tổ hợp.', 'C. III. Kết quả lô II tương ứng với trường hợp vi khuẩn B trong đĩa thạch Z.', 'D. IV. Nếu bổ sung tetracycline vào lô II, kết quả thí nghiệm giống trường hợp vi khuẩn A trong đĩa Y.', 'A. II, III, IV.\tB. I, II, III.\tC. I, II, IV.\tD. I, III.', 'F. Phần II. Dạng thức trắc nghiệm dạng Đúng/Sai']",1764087247632-Sinh_Dethi_ThptNguyenTatThanh.docx
"Câu 1: Nghiên cứu enzyme E ở hai loài trong cùng một chi, người ta xác định được hai biến thế enzyme E1 và E2 chúng cùng xúc tác cho một phản ứng trong tế bào. Hai biến thể này không chỉ có cùng số lượng amino acid trong chuỗi polypeptide mà trình tự các amino acid cũng giống nhau ở hầu hết các đoạn, ngoại trừ một đoạn kí hiệu là 5, ở biển thể E1 và S2 ở biến thế E2. Trình tự amino acid và trình tự nucleotide của các biến thể là như sau.","['A. Đoạn DNA ở mạch khuôn của E1:', ""B. 3'CAG-GTA-TAA-GTT-TTT-GGA-AGT-CGA 5."", 'C. Đoạn S1 của biến thể E1: Val - His - Ile - Gln - Lys - Pro - Ser - Ala.', 'D. Đoạn S2 của biến thể E2: Val - Leu - Ile - Gln - Asn - Pro-Ser - Ala.']",1764087247632-Sinh_Dethi_ThptNguyenTatThanh.docx
Mỗi phát biểu sau là Đúng hay Sai ?,"['A. a. Tỉ lệ A/G của đoạn gene mã hóa S1 là 5/3.', 'B. b. Đoạn gene mã hoá S1 có thể đã xảy ra đột biến thay thế cặp nucleotide T = A bằng cặp A = T ở hai vị trí để tạo ra S2.']",1764087247632-Sinh_Dethi_ThptNguyenTatThanh.docx
"c. Nếu phân li các đoạn gene mã hoá S1 và S2 thành các mạch đơn, sau đó cho chúng bắt cập thành từng đôi ngẫu nhiên với nhau thì tổ hợp hai mạch bắt cặp chính xác tối đa chiếm tỉ lệ 1/18.","['A. d. Trong cùng điều kiện phản ứng, người ta nhận thấy hiệu quả xúc tác của biến thể E2 thấp hơn E1, chứng tỏ đột biến này đã làm thay đổi cấu trúc, chức năng của protein nên hiệu quả xúc tác phản ứng của E2 kém hơn.']",1764087247632-Sinh_Dethi_ThptNguyenTatThanh.docx
"Cho biết các allele a, b, d không tổng hợp enzyme để chuyển hoá. Theo lí thuyết, mỗi phát biểu sau đây là Đúng hay Sai?","['A. a. Allele D tương tác với allele A hoặc B để tạo ra màu lông tương ứng là màu tím hoặc xanh lá cây.', 'B. b. Trong quần thể, số loại kiểu gene của kiểu hình màu xanh da trời nhiều hơn kiểu hình màu tím là 2.', 'C. c. Số phép lai tối đa xảy ra giữa một con vẹt màu xanh lá cây dị hợp và một con vẹt màu trắng là 24.', 'D. d. Phép lai giữa một con vẹt màu tím và một con vẹt màu đỏ tạo ra F1 có thể có tỉ lệ kiểu hình: 3 màu tím : 3 màu đỏ : 2 trắng.']",1764087247632-Sinh_Dethi_ThptNguyenTatThanh.docx
"Câu 3 Một nhóm học sinh trồng ba cây giống nhau vào ba chậu và đặt chúng trong các điều kiện nhiệt độ khác nhau: Chậu 1: Nhiệt độ 25°C; Chậu 2: Nhiệt độ 10°C; Chậu 3: Nhiệt độ 40°C. Sau 10 ngày, cây ở chậu 1 phát triển bình thường, cây ở chậu 2 sinh trưởng chậm, còn cây ở chậu 3 bị héo và chết. Xác định những mệnh đề sau đúng hay sai.","['A. a. Cây sinh trưởng tốt nhất ở nhiệt độ 25°C.', 'B. b. Nhiệt độ không ảnh hưởng đến sinh trưởng của cây.', 'C. c. Nhiệt độ quá thấp hoặc quá cao đều có thể làm giảm sinh trưởng của cây.', 'D. d. Cây ở chậu 3 chết vì nhiệt độ quá cao làm rối loạn quá trình trao đổi chất.']",1764087247632-Sinh_Dethi_ThptNguyenTatThanh.docx
"Câu 4: Hầu hết các vùng đất nông nghiệp trù phú nằm trong vùng trùng và bị đe dọa bởi nước biển dâng. Loài Spartina patens và Typha angustifolia là những thực vật đám lấy ở khu vực nội lục châu Mỹ. Để nghiên cứu ảnh hưởng của nước biển tới hai loài thực vật này, các nhà nghiên cứu đã tiến hành một loạt các thí nghiệm: trồng chung hoặc trồng riêng hai loài thực vật trong các đám lấy nước mặn và đám lấy nước ngọt, hoặc trong nhà kính với các độ mặn khác nhau. Sinh khối trung bình (g/cm²) của hai loài được thể hiện ở Hình a và b.","['A. a. Tại độ mặn 20% thì sinh khối trung bình của loài S. patens cao gấp khoảng hai lần của loài T. angustifolia.', 'B. b. Khả năng chịu mặn của loài S. patens tốt hơn loài T. angustifolia.', 'C. c. Ở đầm lầy nước ngọt, loài T. angustifolia có ưu thế cạnh tranh tốt hơn.', 'D. d. Ở khu vực do triều cường khiến nước biển dâng lên cao thường xuyên, trống loài S. patens sẽ bảo vệ đất nông nghiệp hiệu quả hơn.', 'E. Phần III. Dạng thức trắc nghiệm dạng trả lời ngắn']",1764087247632-Sinh_Dethi_ThptNguyenTatThanh.docx
"Câu 6: DDT là một loại thuốc trừ sâu hữu cơ tổng hợp nhân tạo, được sản xuất quy mô công nghiệp và sử dụng rộng rãi từ năm 1940. DDT rất hiệu quả để phòng trừ sâu bại trong thời gian đầu, tuy nhiên chỉ trong vài năm đã xuất hiện các quần thể sâu kháng thuốc DDT. Quá trình tiến hoá của sâu theo trình tự thời gian có thể gồm các ý như sau:","['A. (1) Hầu hết quần thể sâu kháng với DDT.', 'B. (2) Xuất hiện đột biến ở một gene mã hóa enzyme làm sâu có khả năng kháng thuốc.', 'C. (3) Cá thể sâu mang gene kháng thuốc sinh sản và truyền allele quy định khả năng kháng thuốc qua các thế hệ.', 'D. (4) Các cá thể sâu nhạy cảm với DDT bị chết khi con người dùng thuốc trừ sâu.', 'E. (5) Tần số của allele kháng thuốc trong quần thể tăng lên.', 'F. (6) Sâu mang gene kháng thuốc có ưu thế chọn lọc và sống sót.']",1764087247632-Sinh_Dethi_ThptNguyenTatThanh.docx
Các bạn học sinh sắp xếp các ý trên theo trật tự quá trình tiến hoá của sâu như sau:,"['A. Học sinh 1: (4)→(6)→(2)→(3)→(5)→(1).', 'B. Học sinh 2: (2)→(6)→(4)→(3)→(5)→(1).', 'C. Học sinh 3: (4)→(6)→(3)→(2)→(5)→(1).', 'D. Học sinh 4: (2)→(4)→(6)→(3)→(5)→(1).']",1764087247632-Sinh_Dethi_ThptNguyenTatThanh.docx
"ĐÁP ÁN, MÃ HÓA, HƯỚNG DẪN GIẢI ĐỀ THAM KHẢO TỐT NGHIỆP MÔN SINH NĂM HỌC 2024- 2025",['A. Phần I. Dạng thức trắc nghiệm nhiều lựa chọn'],1764087247632-Sinh_Dethi_ThptNguyenTatThanh.docx
Câu 1,"['A. 6.15_1_1_1. Trong các bằng chứng tiến hóa, bằng chứng nào là chính xác nhất?', 'A. Hóa thạch.\t\t\t\tB. Bằng chứng giải phẫu so sánh.', 'C. Bằng chứng tế bào học.\t\tD. Bằng chứng sinh học phân tử.', 'D. Đáp án : D']",1764087247632-Sinh_Dethi_ThptNguyenTatThanh.docx
1.2_1_1_1. Câu 2: Ví dụ nào sau đây nói lên tính chuyên hoá của enzyme?,"['A. Trong 1 phút, một phân tử amylase thuỷ phân được 1 triệu phân tử amylopectin.', 'B. Amylase chỉ thuỷ phân được tinh bột, không thuỷ phân được cellulose..', 'C. Amylase bị bất hoạt ở nhiệt độ trên 60 0C hoặc dưới 00C.', 'D. Amylase có hoạt tính xúc tác mạnh ở môi trường có pH từ 7 đến 8.', 'E. Đáp án : B']",1764087247632-Sinh_Dethi_ThptNguyenTatThanh.docx
Câu 3,"['A. 5.11_1_1_1.Cấu trúc nào sau đây tổng hợp protein điều hoà, protein này tham gia điều khiến họat động của operon Lac ở vi khuẩn E. coli?', 'A. Vùng điều hoà.\tB. Vùng vận hành.\tC. Gene điều hoà.\tD. Gene cấu trúc Z', 'C. Đáp án : C']",1764087247632-Sinh_Dethi_ThptNguyenTatThanh.docx
Câu 4,"['A. 5.11_1_1_1.Cơ thể có bộ NST nào sau đây thuộc đa bội lẻ?', 'A. n.\tB. 3n.\tC. 4n.\tD. 2n + 1.', 'C. Đáp án : B']",1764087247632-Sinh_Dethi_ThptNguyenTatThanh.docx
Câu 5,"['A. 5.12_1_1_1. Theo lí thuyết, loại giao tử abd có tỉ lệ 12,5% được tạo ra từ cơ thể có kiểu gene', 'A. AaBbDd.\tB. aaBbDd.\tC. AaBbDD.\tD. aabbDd.', 'C. Đáp án : A']",1764087247632-Sinh_Dethi_ThptNguyenTatThanh.docx
Câu 6,"['A. 5.12_2_1_1. Thành tựu nào dưới đây được tạo ra từ ứng dụng của phương pháp lai hữu tính?', 'A. Vi khuẩn E. coli sản xuất hormone insulin của người.', 'B. Giống gà đông tảo ở Hưng Yên có kích thước lớn; chân to, thô.', 'C. Dê chuyển gene sản xuất sữa chứa protein CFTR chữa bệnh u xơ nang.', 'D. Cừu chuyển gene tổng hợp protein của người trong sữa.', 'F. Đáp án : B']",1764087247632-Sinh_Dethi_ThptNguyenTatThanh.docx
Câu 7,"['A. 5.14_1_1_1. Một quần thể có thành phần kiểu gene là 0,16 AA: 0,48 Aa: 0,36 aa Theo lí thuyết, tần số allele A của quần thể này là', 'A. 0,7.\tB. 0,3.\tC. 0,4.\tD. 0,5.', 'C. Đáp án : C']",1764087247632-Sinh_Dethi_ThptNguyenTatThanh.docx
Câu 8,"['A. 6.15_1_1_1. Bằng chứng trực tiếp cho thấy các sinh vật đã tồn tại và tiến hoá trên Trái Đất là', 'A. hoá thạch.  B. cơ quan tương tự.  C. cơ quan tương đồng.  D. cơ quan thoái hoá', 'C. Đáp án : A']",1764087247632-Sinh_Dethi_ThptNguyenTatThanh.docx
Câu 9,"['A. 3.6_2_1_1. Ở thực vật, thông tin kích thích sẽ được truyền qua tế bào chất dưới dạng nào?', 'A. Hormone, enzyme.\t\tB. Dòng điện tử hoặc chất hóa học.', 'C. Tín hiệu thần kinh. \t\tD. Dòng mạch gỗ và mạch rây.']",1764087247632-Sinh_Dethi_ThptNguyenTatThanh.docx
Câu 10,"['A. 7.18_1_1_1. Năm 2020, hiện tượng cháy rừng ở Australia đã làm cho số lượng thủ có túi giảm mạnh. Sự biến động số lượng cá thể của quần thể thú có túi là dạng biến động', 'A. theo chu kì nhiều năm.\tC. theo chu kì ngày đêm.', 'B. theo chu kì mùa.\t\tD. không theo chu kì.', 'D. Đáp án : D']",1764087247632-Sinh_Dethi_ThptNguyenTatThanh.docx
Câu 11,"['A. 7.17_1_1_1.Đàn chim hải âu lông mày đen (Thalassarche melanophris) ở quần đảo Falkland làm tổ cách đều nhau trong mùa sinh sản. Hiện tượng này mô tả kiểu phân bố cá thể của quần thể nào sau đây?', 'A. Phân bố đồng đều.\t\tB. Phân bố nhóm.\tC. Phân bố ngẫu nhiên.\t\tD. Phân bố rời rạc.', 'C. Đáp án : A']",1764087247632-Sinh_Dethi_ThptNguyenTatThanh.docx
Câu 12,"['A. 6.15_2_1_1. Để xác định tuổi hóa thạch người ta dùng phương pháp:', 'A. quan sát hình thái bên ngoài hóa thạch.\tB. quan sát hình thái bên trong của hóa thạch.', 'C. dựa vào vị trí tìm được hoá thạch.\t\tD. dựa vào lượng đồng vị phóng xạ có trong hóa thạch.', 'D. Đáp án : D']",1764087247632-Sinh_Dethi_ThptNguyenTatThanh.docx
Câu 13,"['A. 6.15_1_1_1.Quá trình hình thành các hợp chất hữu cơ từ các chất vô cơ, xảy ra khi Trái Đất mới hình thành. Đây là đặc điểm của giai đoạn:', 'A. tiến hoá hoá học.\t\tB. tiến hoá tiền sinh học.', 'C. tiến hoá sinh học.\t\tD. tiến hoá tiền hoá học.', 'D. Đáp án : A']",1764087247632-Sinh_Dethi_ThptNguyenTatThanh.docx
Câu 14,"['A. 3.7_2_1_1. Trường hợp nào sau đây, huyết áp trong hệ mạch của người sẽ bị giảm?', 'A. Tim đập nhanh và mạnh.\tB. Cơ thể bị mất nhiều máu.', 'C. Ăn mặn trong thời gian dài.\tD. Người bị bệnh xơ vữa động mạch.', 'D. Đáp án : B']",1764087247632-Sinh_Dethi_ThptNguyenTatThanh.docx
Câu 15,"[""A. 5.11_2_1_1. Một protease có một trung tâm họat động chứa ba góc glutamic acid (Glu) liên tiếp; vùng này được mã hoá bởi trình tự nucleotide trên mRNA: 5'-GAA-GAA-GAA-3: Nếu bị đột biến gene, trình tự mới nào sau đây có khả năng tạo ra sản phẩm protein có mình tự amino acid giống protein ban đầu nhất? Biết các codon mã hoá amino acid là GAG-3, 5'-GAA-3': Glu; 5'-GGA-3': Gly; 5'-CAA-3': Gin."", ""A. 5'-GAA-GGA-GAA-3’.\tB. 5'-GAG-GAG-GAA-3’."", ""C. 5'-GAA-UAA-AGAA-3’.\tD. 5'-GAA-CAA-AGAA-3’."", 'D. Đáp án : B']",1764087247632-Sinh_Dethi_ThptNguyenTatThanh.docx
Câu 16.,"['A. 5.16_1_1_1. Hiện tượng con chim công đực có màu sắc sặc sỡ thu hút được nhiều chim cái giao phối làm tăng khả năng sinh sản, tuy nhiên, màu sắc sặc sỡ cũng làm cho nó dễ bị nhiều loài săn mồi phát hiện. Điều này chứng tỏ', 'A. đặc điểm thích nghi chỉ mang tính tương đối.', 'B. đặc điểm thích nghi không thay đổi.', 'C. cơ thể cần có nhiều đặc điểm thích nghi bền vững.', 'D. khả năng sinh sản quyết định khả năng thích nghi.', 'F. Đáp án : A']",1764087247632-Sinh_Dethi_ThptNguyenTatThanh.docx
"7.17_2_1_1. Hình sau mô tả ba kiểu phân bố cá thể của quần thể trong môi trường thuộc ba loài giả định trong diện tích như nhau. Cho rằng các khu vực còn lại của ba quần thể nghiên cứu là không có sự khác biệt so với mô tả ở hình dưới và mỗi dấu chấm minh họa cho một cá thể. Theo lí thuyết, có phát biểu nào sau đây là sai?","['A. Kiểu phân bố I thể hiện cá thể tận dụng được nguồn sống tiềm tàng trong môi trường.', 'B. Kiểu phân bố II xảy ra khi điều kiện sống phân bố đồng đều trong môi trường.', 'C. Kiều phân bố III thể hiện hiệu quả nhóm.', 'D. Kiểu phân bố 1 là kiểu phân bố phổ biến nhất.', 'E. Đáp án :D']",1764087247632-Sinh_Dethi_ThptNguyenTatThanh.docx
Câu 18.,"['A. 1.2._3_1_1.Một thí nghiệm chuyển gene thông qua plasmid đã được tiến hành trên đối tượng vi khuẩn X. Biết rằng vi khuẩn này vốn không có khả năng kháng chất kháng sinh tetracycline, plasmid dùng làm thể truyền có chứa gene kháng thuốc kháng sinh tetracycline. Sau thí nghiệm, nhà khoa học tiếp tục chuẩn bị hai lô vi khuẩn (A, B), trong đó một lô chứa vi khuẩn × bình thường (chưa được xử lí ), lỗ còn lại là vi khuẩn × có chứa DNA tái tổ hợp trên; hai loại đĩa thạch có môi trường cơ bản (Z, Y ) trong đó một loại có chứa chất kháng sinh tetracycline và một loại đĩa không chứa chất kháng sinh trên. Tiếp tục nuôi cấy hai loài vi khuẩn A, B vào môi trường hai loại đĩa thạch được bố trí như sau:', 'B. - Lô I: Đĩa thạch không chứa tetracycline + vi khuẩn bình thường.', 'C. - Lô II: Đĩa thạch không chứa tetracycline + vi khuẩn đã được xử lí.', 'D. - Lô III: Đĩa thạch chứa tetracycline + vi khuẩn bình thường.', 'E. - Lô IV: Đĩa thạch chứa tetracycline + vi khuẩn đã được xử lí.']",1764087247632-Sinh_Dethi_ThptNguyenTatThanh.docx
"Theo lí thuyết, những nhận định nào sau đây đúng?","['A. 1. Chỉ những vi khuẩn × có chứa DNA tái tổ hợp trên có tính kháng tetracycline.', 'B. II. Vi khuẩn A và vi khuẩn B lần lượt là vi khuẩn × bình thường và vi khuẩn × có chứa DNA tái tổ hợp.', 'C. III. Kết quả lô II tương ứng với trường hợp vi khuẩn B trong đĩa thạch Z.', 'D. IV. Nếu bổ sung tetracycline vào lô II, kết quả thí nghiệm giống trường hợp vi khuẩn A trong đĩa Y.', 'A. II, III, IV.\tB. I, II, III.\tC. I, II, IV.\tD. I, III.', 'F. Đáp án : B', 'G. Phần II. Dạng thức trắc nghiệm dạng Đúng/Sai']",1764087247632-Sinh_Dethi_ThptNguyenTatThanh.docx
Câu 1.,"['A. 5.11_1+2+3+3_1+2+2+2_4. Nghiên cứu enzyme E ở hai loài trong cùng một chi, người ta xác định được hai biến thế enzyme E1 và E2 chúng cùng xúc tác cho một phản ứng trong tế bào. Hai biến thể này không chỉ có cùng số lượng amino acid trong chuỗi polypeptide mà trình tự các amino acid cũng giống nhau ở hầu hết các đoạn, ngoại trừ một đoạn kí hiệu là 5, ở biển thể E1 và S2 ở biến thế E2. Trình tự amino acid và trình tự nucleotide của các biến thể là như sau.', 'B. Đoạn DNA ở mạch khuôn của E1:', ""C. 3'CAG-GTA-TAA-GTT-TTT-GGA-AGT-CGA 5."", 'D. Đoạn S1 của biến thể E1: Val - His - Ile - Gln - Lys - Pro - Ser - Ala.', 'E. Đoạn S2 của biến thể E2: Val - Leu - Ile - Gln - Asn - Pro-Ser - Ala.']",1764087247632-Sinh_Dethi_ThptNguyenTatThanh.docx
